{
  "$schema": "https://json-schema.org/draft/2020-12/schema",
  "$id": "https://qory.dev/contracts/runner/v1/sealed-plaintext.schema.json",
  "title": "Sealed plaintext",
  "description": "What the envelope of secrets-answer.schema.json opens to: the digest, the set of connections and the values by secret id and value id, nothing else. The runner checks run_configuration against the digest it computed and connections against the set it sent. The pairs of secret and value_id are exactly the distinct pairs those connections reference with an id, each once, sorted by secret and then by value_id, a value without one first. A member the schema does not define is refused, and so is a member name twice in one object.",
  "type": "object",
  "additionalProperties": false,
  "required": ["version", "run_configuration", "connections", "values"],
  "properties": {
    "version": {
      "description": "The document format. A runner refuses a version it does not read.",
      "const": 1
    },
    "run_configuration": {
      "description": "The digest of the rendering the values were sealed from, sha256= and 64 lower-case hex digits.",
      "type": "string",
      "pattern": "^sha256=[0-9a-f]{64}$"
    },
    "connections": {
      "description": "The connections of the request, sorted.",
      "type": "array",
      "minItems": 1,
      "maxItems": 32,
      "uniqueItems": true,
      "items": {"type": "string", "pattern": "^con_[0-9a-hjkmnp-tv-z]{16}$"}
    },
    "values": {
      "description": "The stored values, at most 32 and 512 KiB in all.",
      "type": "array",
      "maxItems": 32,
      "items": {
        "type": "object",
        "additionalProperties": false,
        "required": ["secret", "value"],
        "properties": {
          "secret": {"description": "The secret's id: sec_ and 16 lower-case Crockford base32 characters.", "type": "string", "pattern": "^sec_[0-9a-hjkmnp-tv-z]{16}$"},
          "value_id": {"description": "The value's id within a secret with several values; absent for a secret with one value.", "type": "string", "pattern": "^[a-z0-9][a-z0-9_.-]{0,63}$"},
          "value": {"description": "The value: UTF-8 text of 1 to 16384 bytes, with no NUL. A value set in a header also has no control character other than tab and no leading or trailing space or tab; the runner checks that where it uses the value.", "type": "string", "minLength": 1, "maxLength": 16384, "pattern": "^[^\\x00]+$"}
        }
      }
    }
  }
}
