{"version":1,"run_configuration":"sha256=b93d70096dc5990448621fa158d0dbd85a35a4522134100d9ec98f1648675eb3","connections":["con_0b5n6t2r9y4f7j3s","con_7q2m4k9x0d3h8w1c"],"values":[{"secret":"sec_3fz8k2m9q4w7x1d6","value":"fixture-value-not-a-real-one"},{"secret":"sec_9c4r7t2y5b8n1h3e","value_id":"production","value":"-----BEGIN FIXTURE-----\nnot-a-real-key\n-----END FIXTURE-----\n"}]}